{
  "$schema": "https://bloktastic.dev/schema/bloktastic.schema.json",
  "name": "accordion",
  "type": "component",
  "version": "1.0.0",
  "title": "Accordion",
  "description": "Expandable accordion component for FAQs, feature lists, or any collapsible content sections",
  
  "author": {
    "name": "Bloktastic",
    "github": "bloktastic"
  },
  
  "compatibility": {
    "storyblok": ">=2.0.0",
    "frameworks": ["vue", "nuxt", "react", "nextjs", "astro", "agnostic"]
  },
  
  "tags": ["accordion", "faq", "expandable", "collapse", "disclosure"],
  "category": "content",
  
  "files": {
    "schema": "schema.json",
    "prompt": "prompt.md",
    "readme": "README.md"
  },
  
  "dependencies": {
    "bloktastic": [],
    "storyblok": []
  },
  
  "preview": {
    "thumbnail": "https://bloktastic.dev/previews/accordion-thumb.png"
  },
  
  "metadata": {
    "created": "2026-01-28",
    "updated": "2026-01-28",
    "downloads": 0,
    "status": "stable"
  }
}
